{"assumptions":["Gold generated by deterministic trusted compiler."],"case_id":"TST-HID-REL-000269","dataset_manifest_hash":"sha256:d7464e6855f047fca1c692e6822e4e413feb45d5233cc53524aa5e74b7a4000f","dataset_version":"0.1.0","execution_timestamp_utc":"2026-08-11T00:00:00Z","ordering":{"fields":["contribution_margin_pct"],"ordered":true,"tie_policy":"deterministic metric/dimension sort from trusted compiler"},"outcome":"ALLOW","plan_hash":"sha256:75d02ebf378ff653d7e5ce3cf3c42f072132d90fa3039555b89d78ab77ef26d5","query_hash":"sha256:ba1823179280d228d53ba229463c41e509afc282201508b8bfafe0a3eb2ecf76","review":{"notes":["Owner reviewed and approved the F7 release-scale RC2 benchmark cases and gold artifacts after bilingual pt-BR localization correction."],"reviewed_at":"2026-08-11T18:00:00Z","reviewer":"Bruno Santos Teixeira","status":"approved"},"rows":[{"category":"category_06","contribution_margin_pct":"0.503896"},{"category":"category_08","contribution_margin_pct":"0.470796"},{"category":"category_05","contribution_margin_pct":"0.466446"},{"category":"category_10","contribution_margin_pct":"0.452447"},{"category":"category_07","contribution_margin_pct":"0.434840"},{"category":"category_11","contribution_margin_pct":"0.429376"},{"category":"category_09","contribution_margin_pct":"0.428952"},{"category":"category_03","contribution_margin_pct":"0.420226"},{"category":"category_02","contribution_margin_pct":"0.415568"},{"category":"category_01","contribution_margin_pct":"0.413801"},{"category":"category_04","contribution_margin_pct":"0.320886"},{"category":"category_12","contribution_margin_pct":"0.311488"}],"schema_version":"1.0","tolerances":{"contribution_margin_pct":{"absolute":"0.000001","relative":"0"}},"units":{"contribution_margin_pct":"ratio"}}
