{"assumptions":["Sequence transition coverage: reset."],"case_id":"MT-REL-000043","dataset_manifest_hash":"sha256:d7464e6855f047fca1c692e6822e4e413feb45d5233cc53524aa5e74b7a4000f","dataset_version":"0.1.0","execution_timestamp_utc":"2026-08-11T00:00:00Z","ordering":{"fields":["gross_revenue"],"ordered":true,"tie_policy":"deterministic metric/dimension sort from trusted compiler"},"outcome":"ALLOW","plan_hash":"sha256:aec3717c2a00f54e738c15cc120b11450dfcf3a00c87d8f0e12c2b0620e8633d","query_hash":"sha256:0039a4f938f71b870ebd31e1472af60ee5c3f72de723ee59f2fd9333da229eb8","review":{"notes":["Owner reviewed and approved the F7 release-scale RC2 benchmark cases and gold artifacts after bilingual pt-BR localization correction."],"reviewed_at":"2026-08-11T18:00:00Z","reviewer":"Bruno Santos Teixeira","status":"approved"},"rows":[{"channel":"retail","gross_revenue":"5770975.07"},{"channel":"online","gross_revenue":"3728204.91"},{"channel":"marketplace","gross_revenue":"2997468.52"},{"channel":"wholesale","gross_revenue":"2214972.26"},{"channel":"partner","gross_revenue":"2158252.84"},{"channel":"mobile","gross_revenue":"1915755.00"}],"schema_version":"1.0","tolerances":{"gross_revenue":{"absolute":"0.01","relative":"0"}},"units":{"gross_revenue":"usd"}}
