{"assumptions":["Gold generated by deterministic trusted compiler."],"case_id":"TST-HID-REL-000030","dataset_manifest_hash":"sha256:d7464e6855f047fca1c692e6822e4e413feb45d5233cc53524aa5e74b7a4000f","dataset_version":"0.1.0","execution_timestamp_utc":"2026-08-11T00:00:00Z","ordering":{"fields":["active_contract_value"],"ordered":true,"tie_policy":"deterministic metric/dimension sort from trusted compiler"},"outcome":"ALLOW","plan_hash":"sha256:561a64ddb00188fa54776d03df272fd6517caab58ed818b770c35ef547f47c07","query_hash":"sha256:c95313edeb799705a36692a2c4f38dece1cee9252223fb21882c99de0a8fde8a","review":{"notes":["Owner reviewed and approved the F7 release-scale RC2 benchmark cases and gold artifacts after bilingual pt-BR localization correction."],"reviewed_at":"2026-08-11T18:00:00Z","reviewer":"Bruno Santos Teixeira","status":"approved"},"rows":[{"active_contract_value":"54281.20","contract_risk":"low"},{"active_contract_value":"21712.74","contract_risk":"medium"}],"schema_version":"1.0","tolerances":{"active_contract_value":{"absolute":"0.01","relative":"0"}},"units":{"active_contract_value":"usd"}}
