{"assumptions":["Gold generated by deterministic trusted compiler."],"case_id":"TST-HID-REL-000097","dataset_manifest_hash":"sha256:d7464e6855f047fca1c692e6822e4e413feb45d5233cc53524aa5e74b7a4000f","dataset_version":"0.1.0","execution_timestamp_utc":"2026-08-11T00:00:00Z","ordering":{"fields":["contribution_margin"],"ordered":true,"tie_policy":"deterministic metric/dimension sort from trusted compiler"},"outcome":"ALLOW","plan_hash":"sha256:4e49cb2c6b2ce14535fea2d77d3b3944d8da086a340f0234e78dd723e1cac534","query_hash":"sha256:b23185e7551fec17b69b67b0af8d150adf8ee4bca883b817688d7ec2e850c349","review":{"notes":["Owner reviewed and approved the F7 release-scale RC2 benchmark cases and gold artifacts after bilingual pt-BR localization correction."],"reviewed_at":"2026-08-11T18:00:00Z","reviewer":"Bruno Santos Teixeira","status":"approved"},"rows":[{"category":"category_01","contribution_margin":"3661.60"},{"category":"category_02","contribution_margin":"3452.66"},{"category":"category_05","contribution_margin":"2652.83"},{"category":"category_11","contribution_margin":"2218.60"},{"category":"category_03","contribution_margin":"1854.30"}],"schema_version":"1.0","tolerances":{"contribution_margin":{"absolute":"0.01","relative":"0"}},"units":{"contribution_margin":"usd"}}
