{"assumptions":["Gold generated by deterministic trusted compiler."],"case_id":"DEV-REL-000068","dataset_manifest_hash":"sha256:d7464e6855f047fca1c692e6822e4e413feb45d5233cc53524aa5e74b7a4000f","dataset_version":"0.1.0","execution_timestamp_utc":"2026-08-11T00:00:00Z","ordering":{"fields":["budget_variance_pct"],"ordered":true,"tie_policy":"deterministic metric/dimension sort from trusted compiler"},"outcome":"ALLOW","plan_hash":"sha256:e6eb4e7e8f2cce822ca4c285dfb197916f97f880a139a29ecb6e4619fd4ff2cc","query_hash":"sha256:68ead6799c17de82b0bea5ece266fd8400acc663caa09d6b91b204265062449d","review":{"notes":["Owner reviewed and approved the F7 release-scale RC2 benchmark cases and gold artifacts after bilingual pt-BR localization correction."],"reviewed_at":"2026-08-11T18:00:00Z","reviewer":"Bruno Santos Teixeira","status":"approved"},"rows":[{"budget_variance_pct":"0.081889","expense_category":"expense_02"},{"budget_variance_pct":"-0.369086","expense_category":"expense_01"},{"budget_variance_pct":"-0.521334","expense_category":"expense_04"},{"budget_variance_pct":"-0.836540","expense_category":"expense_03"}],"schema_version":"1.0","tolerances":{"budget_variance_pct":{"absolute":"0.000001","relative":"0"}},"units":{"budget_variance_pct":"ratio"}}
