{"assumptions":["Gold generated by deterministic trusted compiler."],"case_id":"VAL-REL-000254","dataset_manifest_hash":"sha256:d7464e6855f047fca1c692e6822e4e413feb45d5233cc53524aa5e74b7a4000f","dataset_version":"0.1.0","execution_timestamp_utc":"2026-08-11T00:00:00Z","ordering":{"fields":["gross_revenue"],"ordered":true,"tie_policy":"deterministic metric/dimension sort from trusted compiler"},"outcome":"ALLOW","plan_hash":"sha256:f9af31e070347da9dab9fd5227e956a42521149b5dc6e66f0c12656c21e2dae7","query_hash":"sha256:a32127fb5ebae151538497bcd17eb2e24dd47a8cef80651857613e8ababa3cd8","review":{"notes":["Owner reviewed and approved the F7 release-scale RC2 benchmark cases and gold artifacts after bilingual pt-BR localization correction."],"reviewed_at":"2026-08-11T18:00:00Z","reviewer":"Bruno Santos Teixeira","status":"approved"},"rows":[{"category":"category_02","gross_revenue":"316.31"}],"schema_version":"1.0","tolerances":{"gross_revenue":{"absolute":"0.01","relative":"0"}},"units":{"gross_revenue":"usd"}}
