{"assumptions":["Sequence transition coverage: pronoun_patch."],"case_id":"MT-REL-000113","dataset_manifest_hash":"sha256:d7464e6855f047fca1c692e6822e4e413feb45d5233cc53524aa5e74b7a4000f","dataset_version":"0.1.0","execution_timestamp_utc":"2026-08-11T00:00:00Z","ordering":{"fields":["net_revenue"],"ordered":true,"tie_policy":"deterministic metric/dimension sort from trusted compiler"},"outcome":"ALLOW","plan_hash":"sha256:75ff95e4a413966ee13376cb5a7c46035f681151f9a57736aca8fbc1e373cb37","query_hash":"sha256:78ab03ed021a858b63772275c98fe168e84eeec2eb260b7429cdc747172ce87d","review":{"notes":["Owner reviewed and approved the F7 release-scale RC2 benchmark cases and gold artifacts after bilingual pt-BR localization correction."],"reviewed_at":"2026-08-11T18:00:00Z","reviewer":"Bruno Santos Teixeira","status":"approved"},"rows":[{"net_revenue":"7019821.63","region":"North"},{"net_revenue":"6914802.82","region":"West"},{"net_revenue":"6891652.88","region":"South"},{"net_revenue":"6811097.53","region":"Central"},{"net_revenue":"6738990.65","region":"East"}],"schema_version":"1.0","tolerances":{"net_revenue":{"absolute":"0.01","relative":"0"}},"units":{"net_revenue":"usd"}}
