{"assumptions":["Gold generated by deterministic trusted compiler."],"case_id":"DEV-REL-000136","dataset_manifest_hash":"sha256:d7464e6855f047fca1c692e6822e4e413feb45d5233cc53524aa5e74b7a4000f","dataset_version":"0.1.0","execution_timestamp_utc":"2026-08-11T00:00:00Z","ordering":{"fields":["active_customer_count"],"ordered":true,"tie_policy":"deterministic metric/dimension sort from trusted compiler"},"outcome":"ALLOW","plan_hash":"sha256:db96c5827b7d6418a2fd888a07f5f77bdd2d03fb0640bac51ffa30d65e54dc06","query_hash":"sha256:472abaebe1418e89fdce0d227b1774a0ac8e72f05eea52da0c8f5d8936513a95","review":{"notes":["Owner reviewed and approved the F7 release-scale RC2 benchmark cases and gold artifacts after bilingual pt-BR localization correction."],"reviewed_at":"2026-08-11T18:00:00Z","reviewer":"Bruno Santos Teixeira","status":"approved"},"rows":[{"active_customer_count":20,"channel":"marketplace"},{"active_customer_count":20,"channel":"retail"},{"active_customer_count":19,"channel":"online"},{"active_customer_count":14,"channel":"wholesale"},{"active_customer_count":10,"channel":"mobile"},{"active_customer_count":9,"channel":"partner"}],"schema_version":"1.0","tolerances":{"active_customer_count":{"absolute":"0","relative":"0"}},"units":{"active_customer_count":"count"}}
