{"assumptions":["Gold generated by deterministic trusted compiler."],"case_id":"TST-PUB-REL-000054","dataset_manifest_hash":"sha256:d7464e6855f047fca1c692e6822e4e413feb45d5233cc53524aa5e74b7a4000f","dataset_version":"0.1.0","execution_timestamp_utc":"2026-08-11T00:00:00Z","ordering":{"fields":["quarter"],"ordered":true,"tie_policy":"deterministic metric/dimension sort from trusted compiler"},"outcome":"ALLOW","plan_hash":"sha256:4cbbbb453322f4ab32046c4c9da75db1c888eba82e43fdfe2411d5cf76f37903","query_hash":"sha256:adbe9f4e361fb28b998367dee08a108e8dbe6a2308b23d53bb531e4bec7b02a8","review":{"notes":["Owner reviewed and approved the F7 release-scale RC2 benchmark cases and gold artifacts after bilingual pt-BR localization correction."],"reviewed_at":"2026-08-11T18:00:00Z","reviewer":"Bruno Santos Teixeira","status":"approved"},"rows":[{"net_revenue":"23317.71","quarter":1},{"net_revenue":"23798.93","quarter":2},{"net_revenue":"32258.33","quarter":3},{"net_revenue":"46941.29","quarter":4}],"schema_version":"1.0","tolerances":{"net_revenue":{"absolute":"0.01","relative":"0"}},"units":{"net_revenue":"usd"}}
