{"assumptions":["Gold generated by deterministic trusted compiler."],"case_id":"TST-HID-REL-000216","dataset_manifest_hash":"sha256:d7464e6855f047fca1c692e6822e4e413feb45d5233cc53524aa5e74b7a4000f","dataset_version":"0.1.0","execution_timestamp_utc":"2026-08-11T00:00:00Z","ordering":{"fields":["budget_variance_pct"],"ordered":true,"tie_policy":"deterministic metric/dimension sort from trusted compiler"},"outcome":"ALLOW","plan_hash":"sha256:0af9a502b4985bb2b3ce12bce4a4aeecf502e5f783ddd421770bbfc18b202fb8","query_hash":"sha256:e3e812dbe33cb21839cb70b67ecfe98b9a4d620e8270fd51a21304aaec7e8f51","review":{"notes":["Owner reviewed and approved the F7 release-scale RC2 benchmark cases and gold artifacts after bilingual pt-BR localization correction."],"reviewed_at":"2026-08-11T18:00:00Z","reviewer":"Bruno Santos Teixeira","status":"approved"},"rows":[{"budget_variance_pct":"0.920208","cost_center":"cc_021"},{"budget_variance_pct":"0.686405","cost_center":"cc_006"},{"budget_variance_pct":"0.107902","cost_center":"cc_051"},{"budget_variance_pct":"-0.961801","cost_center":"cc_036"}],"schema_version":"1.0","tolerances":{"budget_variance_pct":{"absolute":"0.000001","relative":"0"}},"units":{"budget_variance_pct":"ratio"}}
