{"assumptions":["Gold generated by deterministic trusted compiler."],"case_id":"DEV-REL-000129","dataset_manifest_hash":"sha256:d7464e6855f047fca1c692e6822e4e413feb45d5233cc53524aa5e74b7a4000f","dataset_version":"0.1.0","execution_timestamp_utc":"2026-08-11T00:00:00Z","ordering":{"fields":["order_count"],"ordered":true,"tie_policy":"deterministic metric/dimension sort from trusted compiler"},"outcome":"ALLOW","plan_hash":"sha256:fb975c00f5874790c7a78b311983312380bf0dbeb9722943bfba62d7c1887d66","query_hash":"sha256:0ac7dec6709fd4fc65e2671042cae1ea5ed2946ac8954c3d152e16f6a17ecd16","review":{"notes":["Owner reviewed and approved the F7 release-scale RC2 benchmark cases and gold artifacts after bilingual pt-BR localization correction."],"reviewed_at":"2026-08-11T18:00:00Z","reviewer":"Bruno Santos Teixeira","status":"approved"},"rows":[{"customer_segment":"education","order_count":23},{"customer_segment":"public","order_count":20},{"customer_segment":"enterprise","order_count":19},{"customer_segment":"small_business","order_count":18},{"customer_segment":"mid_market","order_count":17}],"schema_version":"1.0","tolerances":{"order_count":{"absolute":"0","relative":"0"}},"units":{"order_count":"count"}}
