{"assumptions":["Gold generated by deterministic trusted compiler."],"case_id":"TST-PUB-REL-000040","dataset_manifest_hash":"sha256:d7464e6855f047fca1c692e6822e4e413feb45d5233cc53524aa5e74b7a4000f","dataset_version":"0.1.0","execution_timestamp_utc":"2026-08-11T00:00:00Z","ordering":{"fields":["contribution_margin"],"ordered":true,"tie_policy":"deterministic metric/dimension sort from trusted compiler"},"outcome":"ALLOW","plan_hash":"sha256:d44d0cb0cc7689a9ed0ddd31bdf6ec9cc399fa1107816ba31efecf9277fe4f79","query_hash":"sha256:1ddfc6bf43ceca43c32bf1b3adb0bd2e2091ab20b7bb13c6337168e7719c0639","review":{"notes":["Owner reviewed and approved the F7 release-scale RC2 benchmark cases and gold artifacts after bilingual pt-BR localization correction."],"reviewed_at":"2026-08-11T18:00:00Z","reviewer":"Bruno Santos Teixeira","status":"approved"},"rows":[{"channel":"retail","contribution_margin":"60713.73"},{"channel":"online","contribution_margin":"39335.73"},{"channel":"wholesale","contribution_margin":"26253.91"},{"channel":"partner","contribution_margin":"22908.47"},{"channel":"marketplace","contribution_margin":"17874.54"},{"channel":"mobile","contribution_margin":"17718.41"}],"schema_version":"1.0","tolerances":{"contribution_margin":{"absolute":"0.01","relative":"0"}},"units":{"contribution_margin":"usd"}}
