{"assumptions":["Gold generated by deterministic trusted compiler."],"case_id":"TST-HID-REL-000258","dataset_manifest_hash":"sha256:d7464e6855f047fca1c692e6822e4e413feb45d5233cc53524aa5e74b7a4000f","dataset_version":"0.1.0","execution_timestamp_utc":"2026-08-11T00:00:00Z","ordering":{"fields":["month"],"ordered":true,"tie_policy":"deterministic metric/dimension sort from trusted compiler"},"outcome":"ALLOW","plan_hash":"sha256:47c793727d3faf2e7e755d35f6d1b32238cf1d30d313ec4ebffb1288e8453768","query_hash":"sha256:2ac43846d5e50cb58b4b9e2a8b227837d1bfa3d33c1ea0991106670a751f0719","review":{"notes":["Owner reviewed and approved the F7 release-scale RC2 benchmark cases and gold artifacts after bilingual pt-BR localization correction."],"reviewed_at":"2026-08-11T18:00:00Z","reviewer":"Bruno Santos Teixeira","status":"approved"},"rows":[{"gross_revenue":"21952.68","month":1},{"gross_revenue":"11394.53","month":2},{"gross_revenue":"16561.55","month":3},{"gross_revenue":"18856.67","month":4},{"gross_revenue":"24562.18","month":5},{"gross_revenue":"29176.74","month":6},{"gross_revenue":"19018.12","month":7},{"gross_revenue":"35597.02","month":8},{"gross_revenue":"12125.48","month":9},{"gross_revenue":"42980.10","month":10},{"gross_revenue":"48022.26","month":11},{"gross_revenue":"38106.78","month":12}],"schema_version":"1.0","tolerances":{"gross_revenue":{"absolute":"0.01","relative":"0"}},"units":{"gross_revenue":"usd"}}
