{"assumptions":["Ambiguous metric must be clarified before execution."],"case_id":"TST-PUB-REL-000183","dataset_manifest_hash":"sha256:d7464e6855f047fca1c692e6822e4e413feb45d5233cc53524aa5e74b7a4000f","dataset_version":"0.1.0","execution_timestamp_utc":"2026-08-11T00:00:00Z","ordering":{"fields":[],"ordered":false,"tie_policy":"deterministic metric/dimension sort from trusted compiler"},"outcome":"CLARIFY","plan_hash":null,"query_hash":null,"review":{"notes":["Owner reviewed and approved the F7 release-scale RC2 benchmark cases and gold artifacts after bilingual pt-BR localization correction."],"reviewed_at":"2026-08-11T18:00:00Z","reviewer":"Bruno Santos Teixeira","status":"approved"},"rows":[],"schema_version":"1.0","tolerances":{},"units":{}}
