{"assumptions":["Gold generated by deterministic trusted compiler."],"case_id":"DEV-REL-000171","dataset_manifest_hash":"sha256:d7464e6855f047fca1c692e6822e4e413feb45d5233cc53524aa5e74b7a4000f","dataset_version":"0.1.0","execution_timestamp_utc":"2026-08-11T00:00:00Z","ordering":{"fields":["month"],"ordered":true,"tie_policy":"deterministic metric/dimension sort from trusted compiler"},"outcome":"ALLOW","plan_hash":"sha256:f56a3fcf3c464e58ac3289de4d7f8ca0c9d0a19ee39658148608d36cecca7c9d","query_hash":"sha256:7d9ce024acd31d50f3ad02e1242f1b74fde5ad12535aa0a6b551c70789c3538a","review":{"notes":["Owner reviewed and approved the F7 release-scale RC2 benchmark cases and gold artifacts after bilingual pt-BR localization correction."],"reviewed_at":"2026-08-11T18:00:00Z","reviewer":"Bruno Santos Teixeira","status":"approved"},"rows":[{"expense_amount":"825.99","month":1},{"expense_amount":"1524.88","month":2},{"expense_amount":"2078.34","month":3},{"expense_amount":"1271.87","month":4},{"expense_amount":"286.60","month":5},{"expense_amount":"753.08","month":6},{"expense_amount":"259.37","month":7},{"expense_amount":"1528.11","month":8},{"expense_amount":"793.68","month":9},{"expense_amount":"316.02","month":10},{"expense_amount":"746.28","month":11},{"expense_amount":"2218.04","month":12}],"schema_version":"1.0","tolerances":{"expense_amount":{"absolute":"0.01","relative":"0"}},"units":{"expense_amount":"usd"}}
