{"assumptions":["Gold generated by deterministic trusted compiler."],"case_id":"DEV-REL-000080","dataset_manifest_hash":"sha256:d7464e6855f047fca1c692e6822e4e413feb45d5233cc53524aa5e74b7a4000f","dataset_version":"0.1.0","execution_timestamp_utc":"2026-08-11T00:00:00Z","ordering":{"fields":["region"],"ordered":true,"tie_policy":"deterministic metric/dimension sort from trusted compiler"},"outcome":"ALLOW","plan_hash":"sha256:dd83e097a9e1a6e6c4412721e4eba6b661dfed03f75c0a59a21bf65fbe3ab1e7","query_hash":"sha256:d12e683d8dae64904a0f8693c80b484aca1f84a0dd7c422ad22a7149fa4fa23d","review":{"notes":["Owner reviewed and approved the F7 release-scale RC2 benchmark cases and gold artifacts after bilingual pt-BR localization correction."],"reviewed_at":"2026-08-11T18:00:00Z","reviewer":"Bruno Santos Teixeira","status":"approved"},"rows":[{"order_count":180,"region":"Central"},{"order_count":179,"region":"East"},{"order_count":222,"region":"North"},{"order_count":198,"region":"South"},{"order_count":185,"region":"West"}],"schema_version":"1.0","tolerances":{"order_count":{"absolute":"0","relative":"0"}},"units":{"order_count":"count"}}
