{"assumptions":["Gold generated by deterministic trusted compiler."],"case_id":"TST-HID-REL-000210","dataset_manifest_hash":"sha256:d7464e6855f047fca1c692e6822e4e413feb45d5233cc53524aa5e74b7a4000f","dataset_version":"0.1.0","execution_timestamp_utc":"2026-08-11T00:00:00Z","ordering":{"fields":["budget_variance"],"ordered":true,"tie_policy":"deterministic metric/dimension sort from trusted compiler"},"outcome":"ALLOW","plan_hash":"sha256:f9b5bb07c9bb8364b530586debb6e4164713dec4726d7b59d31d8896c7ed78f7","query_hash":"sha256:0d7b42c3d24e3305903ff457c80056cca85fa184c37de762c5e761c77a7fb82c","review":{"notes":["Owner reviewed and approved the F7 release-scale RC2 benchmark cases and gold artifacts after bilingual pt-BR localization correction."],"reviewed_at":"2026-08-11T18:00:00Z","reviewer":"Bruno Santos Teixeira","status":"approved"},"rows":[{"budget_amount":"431.01","budget_variance":"17.77","department":"department_05","expense_amount":"448.78"}],"schema_version":"1.0","tolerances":{"budget_amount":{"absolute":"0.01","relative":"0"},"budget_variance":{"absolute":"0.01","relative":"0"},"expense_amount":{"absolute":"0.01","relative":"0"}},"units":{"budget_amount":"usd","budget_variance":"usd","expense_amount":"usd"}}
