{"assumptions":["Gold generated by deterministic trusted compiler."],"case_id":"TST-PUB-REL-000416","dataset_manifest_hash":"sha256:d7464e6855f047fca1c692e6822e4e413feb45d5233cc53524aa5e74b7a4000f","dataset_version":"0.1.0","execution_timestamp_utc":"2026-08-11T00:00:00Z","ordering":{"fields":["gross_revenue"],"ordered":true,"tie_policy":"deterministic metric/dimension sort from trusted compiler"},"outcome":"ALLOW","plan_hash":"sha256:af69c8e0f883a6fd22420ae9e8a8351e97d2596f9252a688e9de043d7d06419d","query_hash":"sha256:ff706c09482a8294bececc0c308c2f1ecd124fcfef61cd083345c47da40b8445","review":{"notes":["Owner reviewed and approved the F7 release-scale RC2 benchmark cases and gold artifacts after bilingual pt-BR localization correction."],"reviewed_at":"2026-08-11T18:00:00Z","reviewer":"Bruno Santos Teixeira","status":"approved"},"rows":[{"channel":"online","gross_revenue":"95410.04"},{"channel":"marketplace","gross_revenue":"80284.78"},{"channel":"retail","gross_revenue":"78039.15"},{"channel":"mobile","gross_revenue":"42721.63"},{"channel":"wholesale","gross_revenue":"21274.62"},{"channel":"partner","gross_revenue":"20092.02"}],"schema_version":"1.0","tolerances":{"gross_revenue":{"absolute":"0.01","relative":"0"}},"units":{"gross_revenue":"usd"}}
