{"assumptions":["Gold generated by deterministic trusted compiler."],"case_id":"TST-HID-REL-000148","dataset_manifest_hash":"sha256:d7464e6855f047fca1c692e6822e4e413feb45d5233cc53524aa5e74b7a4000f","dataset_version":"0.1.0","execution_timestamp_utc":"2026-08-11T00:00:00Z","ordering":{"fields":["net_revenue"],"ordered":true,"tie_policy":"deterministic metric/dimension sort from trusted compiler"},"outcome":"ALLOW","plan_hash":"sha256:07ef0993050a5f9c73eb101c16ecbed8f9fa621d5a7bfbe5ec29ef507ac1a2ae","query_hash":"sha256:df2cc15b5674f5a985652548d667b6629d5331cf2f44a081d07f2cdc0e93e71d","review":{"notes":["Owner reviewed and approved the F7 release-scale RC2 benchmark cases and gold artifacts after bilingual pt-BR localization correction."],"reviewed_at":"2026-08-11T18:00:00Z","reviewer":"Bruno Santos Teixeira","status":"approved"},"rows":[{"channel":"partner","net_revenue":"6813.21"},{"channel":"retail","net_revenue":"6386.06"},{"channel":"online","net_revenue":"5829.74"},{"channel":"wholesale","net_revenue":"3127.99"},{"channel":"marketplace","net_revenue":"2705.88"},{"channel":"mobile","net_revenue":"1281.82"}],"schema_version":"1.0","tolerances":{"net_revenue":{"absolute":"0.01","relative":"0"}},"units":{"net_revenue":"usd"}}
