{"assumptions":["Gold generated by deterministic trusted compiler."],"case_id":"TST-PUB-REL-000049","dataset_manifest_hash":"sha256:d7464e6855f047fca1c692e6822e4e413feb45d5233cc53524aa5e74b7a4000f","dataset_version":"0.1.0","execution_timestamp_utc":"2026-08-11T00:00:00Z","ordering":{"fields":["net_revenue"],"ordered":true,"tie_policy":"deterministic metric/dimension sort from trusted compiler"},"outcome":"ALLOW","plan_hash":"sha256:9c57304da750f9e7a5f5b61c5ff8e5c446388dd22f766435f4e2206b518c2dc0","query_hash":"sha256:f3a5d40e0ab4e0f571ffdc5223cd3813c2b3dab1a3beb0c4b2b09f99bc5c9f64","review":{"notes":["Owner reviewed and approved the F7 release-scale RC2 benchmark cases and gold artifacts after bilingual pt-BR localization correction."],"reviewed_at":"2026-08-11T18:00:00Z","reviewer":"Bruno Santos Teixeira","status":"approved"},"rows":[{"category":"category_05","net_revenue":"3752.60"}],"schema_version":"1.0","tolerances":{"net_revenue":{"absolute":"0.01","relative":"0"}},"units":{"net_revenue":"usd"}}
