{"assumptions":["Gold generated by deterministic trusted compiler."],"case_id":"DEV-REL-000043","dataset_manifest_hash":"sha256:d7464e6855f047fca1c692e6822e4e413feb45d5233cc53524aa5e74b7a4000f","dataset_version":"0.1.0","execution_timestamp_utc":"2026-08-11T00:00:00Z","ordering":{"fields":[],"ordered":false,"tie_policy":"deterministic metric/dimension sort from trusted compiler"},"outcome":"ALLOW","plan_hash":"sha256:af6d7b03cc49a1592135e605b84a9fa7a32a9d41b78014e416eb0308053fb4cd","query_hash":"sha256:f42d9fd79499044d31b82988f8c47a946188397785c35ad06e5e0eb2ca95c38a","review":{"notes":["Owner reviewed and approved the F7 release-scale RC2 benchmark cases and gold artifacts after bilingual pt-BR localization correction."],"reviewed_at":"2026-08-11T18:00:00Z","reviewer":"Bruno Santos Teixeira","status":"approved"},"rows":[{"contribution_margin":"18523.96"}],"schema_version":"1.0","tolerances":{"contribution_margin":{"absolute":"0.01","relative":"0"}},"units":{"contribution_margin":"usd"}}
