{"assumptions":["Gold generated by deterministic trusted compiler."],"case_id":"TST-HID-REL-000139","dataset_manifest_hash":"sha256:d7464e6855f047fca1c692e6822e4e413feb45d5233cc53524aa5e74b7a4000f","dataset_version":"0.1.0","execution_timestamp_utc":"2026-08-11T00:00:00Z","ordering":{"fields":["active_customer_count"],"ordered":true,"tie_policy":"deterministic metric/dimension sort from trusted compiler"},"outcome":"ALLOW","plan_hash":"sha256:8aab93d4059b7a4ea95fca0eef8468e79e28ed2107e99ef4ca340989e45e9f06","query_hash":"sha256:02b160e23d39d6c10403289c83b71b4755dc4a73cef7705e8debbae285a8834d","review":{"notes":["Owner reviewed and approved the F7 release-scale RC2 benchmark cases and gold artifacts after bilingual pt-BR localization correction."],"reviewed_at":"2026-08-11T18:00:00Z","reviewer":"Bruno Santos Teixeira","status":"approved"},"rows":[{"active_customer_count":3,"region":"Central"},{"active_customer_count":2,"region":"North"},{"active_customer_count":1,"region":"East"},{"active_customer_count":1,"region":"South"}],"schema_version":"1.0","tolerances":{"active_customer_count":{"absolute":"0","relative":"0"}},"units":{"active_customer_count":"count"}}
